{
  "$schema": "./ddprc.schema.json",
  "maxFiles": 1000,
  "fileFilter": {
    "respectGitignore": false,
    "excludePatterns": [
      "**/*.test.*",
      "**/*.spec.*",
      "**/*Test.java",
      "**/*Tests.java",
      "**/*IT.java",
      "**/__tests__/**",
      "**/test/**",
      "**/tests/**",
      "**/test_*/**"
    ]
  },
  "coverage": {
    "lcovGlob": "**/coverage/lcov.info",
    "jacocoGlob": "**/target/site/jacoco/jacoco.xml"
  },
  "cc": {
    "useEslintForTsJs": true,
    "eslintPath": "node_modules/.bin/eslint",
    "pythonPath": "python3",
    "pmdPath": "pmd"
  },
  "rank": {
    "maxIterations": 100,
    "epsilon": 0.001
  },
  "fileRollup": "max",
  "debug": false,
  "agentIntegration": {
    "warnThreshold": 100,
    "blockThreshold": 500,
    "skipTestFiles": true,
    "skipPatterns": ["**/*.json", "**/*.md", "**/*.yml"]
  },
  "churn": {
    "enabled": true,
    "lookbackDays": 90
  },
  "output": {
    "topFilesCount": 20,
    "topSymbolsCount": 20,
    "riskThresholds": {
      "high": 20,
      "medium": 10
    }
  }
}
